Nome,Name,Descrizione breve,Short description,url,Citta,Indirizzo,Numero civico,latitude,longitude,Da sapere,Good to know,Auto,Scooter,Bicicletta,Van,SegWay,Moto,Telefono,Phone number,Email,Bus,con conducente,Esercizio storico,Orario,Opening times,Come arrivare,How to arrive,Fax,Fax number
Italy Vespa Rental,Italy Vespa Rental,Noleggio Vespa e moto Ducati e BMW,"Vespa, Ducati and BMW motorbike rental",www.italyvesparental.com,Firenze,Via il Prato,50r,43.775380,11.243010,"Veicoli disponibili
Vespa LX/S 125cc e 250cc, moto Ducati, Guzzi e BMW
Requisiti: richiesto documento d'identita'  / passaporto, patente di guida / patente per moto e carta di credito Visa/Mastercard come deposito cauzionale in caso di danno, furto o incendio. Eta'  minima 20 anni per noleggio vespa; eta'  minima 21 anni per noleggio moto. 
Per cittadini non-EU richiesta patente di guida internazionale.","Available vehicles
Vespa LX/S 125cc and 250cc, Ducati, Guzzi and BMW motorbikes.
Passport / ID card, driving / motorcycle licence, credit card for security deposit in case of damage, fire and theft required. Vespa: minimum age 20 years. Motorcycle: minimum age 21 years.
For non-EU drivers International driving licence required.",false,true,false,false,false,true,"+39 055 5385045
+39 349 7852532","+39 055 5385045
+39 349 7852532",info@italyvesparental.com,false,false,false,novembre-febbraio solo su appuntamento; marzo-ottobre lunedi'-domenica 9-18.,November-February by appointment only; March-October Mondayâ€“Sunday 9am-6pm.,Bus: da Piazza Stazione ATAF D verso Ferrucci scendere alla fermata Rucellai proseguire 1 minuto a piedi.,"By bus: bus ATAF D from piazza Stazione direction Ferrucci, get off at the bus stop Rucellai then 1 min. walk.",,
Mazzino,Mazzino,"Vendita, noleggio e riparazione biciclette.","Bike shop, rental and repair service.",www.mazzino.it,Empoli,via Giovanni da Empoli,8,43.717884,10.949416,Punto di noleggio e riparazione delle biciclette.,Bike rental and repair service,false,false,true,false,false,false,+39 0571 73189,+39 0571 73189,info@mazzino.it,false,false,false,"lunedi' 15.30-19.30, martedi'-venerdi' 9-13 / 15.30-19.30, sabato 9-13 / 16-19.30.
Chiuso domenica e lunedi' mattina.","Monday 3.30pm-7.30pm, Tuesday-Friday 9am-1pm / 3.30-7.30pm, Saturday 9am-1pm / 4-7.30pm.
Closed on Monday morning and Sunday.",,,,
Europcar,Europcar,Noleggio auto,Car rental,www.europcar.it,Firenze,VIA ENRICO FORLANINI,2,43.790061,11.228432,L'eta'  minima consentita per il noleggio varia in base al veicolo.,The minimum age required varies according to the vehicle type.,true,false,false,true,false,false,+39 055 4221088,+39 055 4221088,,false,false,false,"lunedi'-venerdi' 8-13 / 15-19, sabato 8-13. 
In altri orari aperto su richiesta","Monday-Friday 8am-1pm / 3pm-7pm, Saturday 8am-1pm. Open at other times on demand.",,,,
Dynamo wheels,Dynamo wheels,Noleggio di Segway,Segway rental,http://www.dw.fi.it/en/rent-segway-in-florence.php,Firenze,VIA GUELFA,29r,43.777247,11.255683,,,false,false,false,false,true,false,"+39 055 0121157
+39 349 2497688","+39 055 0121157
+39 349 2497688",dynamowheels@yahoo.it,false,false,false,"estate lunedi'-domenica 9-20
inverno lunedi'-sabato 10-19","Summer  Monday-Sunday 9am-8pm
Winter Monday-Saturday 10am-7pm",,,,
Auto Europa - Sicily by Car,Auto Europa - Sicily by Car,Noleggio auto e van presso l'aeroporto,Car and van rental at the airport,www.autoeuropa.it,Firenze,VIA DEL PALAGIO DEGLI SPINI,,43.800270,11.201448,"Noleggio consentito a conducente con un'eta'  minima di 21 anni purche' munito di patente di guida valida conseguita da almeno due anni e previo pagamento di un supplemento giornaliero.
Ritiro auto: servizio di navetta gratuito dall'aeroporto alla sede.","Customer with a minimum age of 21 years old, will be required a daily fee and a valid driving licence issued at least two years ago.
Pick-up: Free shuttle service from the airport to the pick-up office.",true,false,false,true,false,false,"+39 055 3436031
+39 345 7462661","+39 055 3436031
+39 345 7462661",firenzeapt@sbc.it,false,false,false,lunedi'-domenica 8.30-22.30 (ritiro fuori orario previo pagamento di supplemento).,Monday-Sunday 8.30am-10.30pm (out of hours service on payment of an extra charge).,,,,
Toscana by bike,Toscana by bike,Toscana by bike,Toscana by bike,www.toscanaebike.com,Montespertoli,VIA TADDEINO TADDEINI,127,43.644734,11.069529,"Info inglese e olandese 
+39 339 5021007",,false,false,true,false,false,false,+39 3939774847,+39 339 5021007,info@toscanaebike.com,false,false,false,,,,,,
Italian Rent,Italian Rent,"Noleggio FIAT 500, scooters, Vespa, moto Guzzi, biciclette.","FIAT 500, scooters, Vespa, Guzzi motorbikes, bike rental.",www.500vespaandguzzi.com,Firenze,VIA MARAGLIANO,84,43.787935,11.232073,"Meeting point solo su appuntamento via Maragliano 84. Richiesta patente in corso di validita' , carta di credito.",Meeting point by appointment only via Maragliano 84. Valid driving licence and credit card are required.,true,true,true,false,false,true,"+39 055 362203
+39 328 3775593","+39 055 362203
+39 328 3775593",italianrent@gmail.com,false,false,false,"lunedi'-sabato 9.30-12.30 / 15.30-18.30, domenica 9.30-12.30","Monday-Saturday 9.30am-12.30pm / 3.30-6.30pm, Sunday 9.30am-12.30pm","Meeting point via Maragliano 84, bus ATAF 22.","Meeting point via Maragliano 84, ATAF bus nr. 22.",,
Tuscany Cycle,Tuscany Cycle,Agenzia di viaggi Florence Bike Tours,Florence Bike Tours travel agency,http://www.tuscanycycle.com/,Firenze,VIA GHIBELLINA,133r,43.770609,11.258114,,,false,true,true,false,false,false,+39 3280714849,+39 3280714849,tuscanycycle@gmail.com,false,false,false,lunedi'-domenica 9-19,Monday-Sunday 9am-7pm,,,,
